{
  "protocol_id": "doc-audit-001",
  "description": "A protocol to ensure the completeness of system documentation.",
  "rules": [
    {
      "rule_id": "audit-for-missing-docstrings",
      "description": "A check for missing module-level docstrings must be performed to ensure documentation completeness. All modules should have comprehensive documentation to aid agents and human users.",
      "enforcement": "This check should be performed by running `make audit-docs`. This can be done periodically or as part of a pre-commit workflow."
    }
  ],
  "associated_tools": [
    "tooling/doc_auditor.py"
  ]
}