{
  "protocol_id": "agent-interaction-001",
  "description": "A protocol governing the agent's core interaction and planning tools.",
  "rules": [
    {
      "rule_id": "planning-tool-access",
      "description": "The agent is authorized to use the `set_plan` tool to create and update its execution plan. This is a foundational capability for task execution.",
      "enforcement": "The agent's core logic should be designed to use this tool for all planning activities."
    },
    {
      "rule_id": "communication-tool-access",
      "description": "The agent is authorized to use the `message_user` tool to communicate with the user, providing updates and asking for clarification. This is essential for a collaborative workflow.",
      "enforcement": "The agent's core logic should be designed to use this tool for all user-facing communication."
    },
    {
      "rule_id": "forbid-list-files-experiment",
      "description": "The agent is forbidden from using the `list_files` tool for this experiment.",
      "enforcement": "This is a hardcoded rule for the experimental protocol."
    }
  ],
  "associated_tools": [
    "set_plan",
    "message_user"
  ]
}