{
  "protocol_id": "dependency-management-001",
  "description": "Ensures a reliable execution environment through formal dependency management.",
  "rules": [
    {
      "rule_id": "dependency-install-on-start",
      "description": "After loading AGENTS.md, the agent MUST install all required Python packages listed in `requirements.txt`.",
      "enforcement": "The agent's core startup logic should execute `pip install -r requirements.txt`."
    }
  ],
  "associated_tools": [
    "run_in_bash_session"
  ]
}