{
  "protocol_id": "reset-all-authorization-001",
  "description": "Requires explicit user authorization via a token file for the use of the destructive `reset_all` tool.",
  "rules": [
    {
      "rule_id": "require-authorization-token",
      "description": "The `reset_all` tool must not execute unless a file named `authorization.token` exists in the repository root.",
      "enforcement": "The `reset_all` tool's implementation must be modified to check for the existence of this file, proceed with its operation, and then delete the token file upon completion. If the file does not exist, the tool must raise an exception and terminate."
    }
  ],
  "associated_tools": [
    "reset_all"
  ]
}