{
  "protocol_id": "csdc-001",
  "description": "A protocol for the Context-Sensitive Development Cycle (CSDC), which introduces development models based on logical constraints.",
  "rules": [
    {
      "rule_id": "use-csdc-cli",
      "description": "The `csdc_cli.py` tool must be used to validate plans under the CSDC, enforcing model-specific (A or B) and complexity (P or EXP) constraints.",
      "enforcement": "The tool is used by invoking it from the command line."
    },
    {
      "rule_id": "model-a-constraints",
      "description": "Model A permits `define_set_of_names` but forbids `define_diagonalization_function`.",
      "enforcement": "Enforced by the `fsm_model_a.json` FSM used by the `csdc_cli.py` tool."
    },
    {
      "rule_id": "model-b-constraints",
      "description": "Model B permits `define_diagonalization_function` but forbids `define_set_of_names`.",
      "enforcement": "Enforced by the `fsm_model_b.json` FSM used by the `csdc_cli.py` tool."
    }
  ],
  "associated_tools": [
    "tooling/csdc_cli.py"
  ]
}